Book Id,Title,Author,Author l-f,Additional Authors,ISBN,ISBN13,My Rating,Average Rating,Publisher,Binding,Number of Pages,Year Published,Original Publication Year,Date Read,Date Added,Bookshelves,Bookshelves with positions,Exclusive Shelf,My Review,Spoiler,Private Notes,Read Count,Recommended For,Recommended By,Owned Copies,Original Purchase Date,Original Purchase Location,Condition,Condition Description,BCID
54988,Nabokov's Blues: The Scientific Odyssey of a Literary Genius,Kurt Johnson,"Johnson, Kurt",Steven L. Coates,"=""0071373306""","=""9780071373302""",0,3.92,McGraw-Hill Companies,Paperback,372,2001,2000,,2018/06/10,to-read,to-read (#46),to-read,,,,0,,,0,,,,,
55981,Consilience: The Unity of Knowledge,Edward O. Wilson,"Wilson, Edward O.",,"=""067976867X""","=""9780679768678""",0,3.92,Vintage,Paperback,368,1999,1998,,2018/06/10,to-read,to-read (#45),to-read,,,,0,,,0,,,,,
1435518,The Meaning of the Body: Aesthetics of Human Understanding,Mark  Johnson,"Johnson, Mark",,"=""0226401928""","=""9780226401928""",0,4.15,University of Chicago Press,Hardcover,326,2007,2007,,2018/06/10,to-read,to-read (#44),to-read,,,,0,,,0,,,,,
1300931,Cognitive Variations: Reflections on the Unity and Diversity of the Human Mind,G.E.R. Lloyd,"Lloyd, G.E.R.",,"=""0199214611""","=""9780199214617""",0,3.75,OUP Oxford,Hardcover,200,2007,2007,,2018/06/10,to-read,to-read (#43),to-read,,,,0,,,0,,,,,
137979,Against Method,Paul Karl Feyerabend,"Feyerabend, Paul Karl",,"=""0860916464""","=""9780860916468""",0,4.00,Verso,Paperback,296,1993,1975,,2018/06/10,to-read,to-read (#42),to-read,,,,0,,,0,,,,,
1039648,Atom and Archetype: The Pauli/Jung Letters 1932-58,Carl Jung,"Jung, Carl","Wolfgang Ernst Pauli, Carl Alfred Meier","=""0691012075""","=""9780691012070""",0,4.17,Princeton University Press (NJ),Hardcover,320,2001,1992,,2018/06/10,to-read,to-read (#41),to-read,,,,0,,,0,,,,,
331816,"Genes, Peoples, and Languages",Luigi Luca Cavalli-Sforza,"Cavalli-Sforza, Luigi Luca",Mark Seielstad,"=""0520228731""","=""9780520228733""",0,3.88,University of California Press,Paperback,239,2001,1996,,2018/06/10,to-read,to-read (#40),to-read,,,,0,,,0,,,,,
150572,"Philosophical Papers, Volume 2: Mathematics, Science and Epistemology",Imre Lakatos,"Lakatos, Imre","Gregory Currie, John Worrall","=""0521280303""","=""9780521280303""",0,4.25,Cambridge University Press,Paperback,296,1980,1978,,2018/06/10,to-read,to-read (#39),to-read,,,,0,,,0,,,,,
19243883,Neanderthal Man: In Search of Lost Genomes,Svante Pääbo,"Pääbo, Svante",,"=""0465020836""","=""9780465020836""",0,4.04,Basic Books,Hardcover,288,2014,2014,,2018/06/10,to-read,to-read (#38),to-read,,,,0,,,0,,,,,
78,Annals of the Former World,John McPhee,"McPhee, John",,"=""0374518734""","=""9780374518738""",0,4.34,"Farrar, Straus and Giroux",Paperback,720,1999,1998,,2018/06/10,to-read,to-read (#37),to-read,,,,0,,,0,,,,,
39936289,Arc d'X: A Novel,Steve Erickson,"Erickson, Steve",,"=""""","=""""",0,3.97,Open Road Media,Kindle Edition,298,2013,1993,,2018/05/01,to-read,to-read (#22),to-read,,,,0,,,0,,,,,
13651,The Dispossessed (Hainish Cycle #6),Ursula K. Le Guin,"Guin, Ursula K. Le",,"=""0061054887""","=""9780061054884""",3,4.20,Harper Voyager,Paperback,387,1994,1974,2018/05/14,2018/05/07,,,read,,,,1,,,0,,,,,
9565745,Il mistero dell'inquisitore Eymerich,Valerio Evangelisti,"Evangelisti, Valerio",,"=""8804525088""","=""9788804525080""",4,3.80,Mondadori,Paperback,308,1998,1996,,2018/05/14,,,read,,,,1,,,0,,,,,
62283,Il corpo e il sangue di Eymerich,Valerio Evangelisti,"Evangelisti, Valerio",,"=""880453818X""","=""9788804538189""",3,3.79,Mondadori,Paperback,272,2005,1996,,2018/05/14,,,read,,,,1,,,0,,,,,
3703868,Le catene di Eymerich,Valerio Evangelisti,"Evangelisti, Valerio",,"=""8804551585""","=""9788804551584""",3,3.80,Arnoldo Mondadori,Paperback,277,2006,1995,,2018/05/14,,,read,,,,1,,,0,,,,,
3245457,"Nicolas Eymerich, inquisitore",Valerio Evangelisti,"Evangelisti, Valerio",,"=""8804528826""","=""9788804528821""",3,3.58,Mondadori,Paperback,274,2004,1994,,2018/05/14,,,read,,,,1,,,0,,,,,
4156478,Exploring Chaos: Theory and Experiment,Brian   Davies,"Davies, Brian",,"=""0738200905""","=""9780738200903""",0,4.25,Westview Press,Hardcover,256,1999,1999,,2018/05/13,to-read,to-read (#36),to-read,,,,0,,,0,,,,,
11525,"1,000 Places to See Before You Die",Patricia Schultz,"Schultz, Patricia",,"=""0761104844""","=""9780761104841""",0,3.85,Workman Publishing Company,Paperback,992,2003,2003,,2018/05/13,to-read,to-read (#35),to-read,,,,0,,,0,,,,,
1168341,Physics of the Impossible,Michio Kaku,"Kaku, Michio",,"=""0385520697""","=""9780385520690""",0,4.08,Doubleday Books,Hardcover,329,2008,2008,,2018/05/10,to-read,to-read (#34),to-read,,,,0,,,0,,,,,
818063,Calculus Made Easy,Silvanus Phillips Thompson,"Thompson, Silvanus Phillips",Martin Gardner,"=""0312185480""","=""9780312185480""",3,4.21,St. Martin's Press,Hardcover,336,1998,1910,2018/05/08,2018/05/01,,,read,,,,1,,,0,,,,,
17891457,Unmasking the Social Engineer: The Human Element of Security,Christopher Hadnagy,"Hadnagy, Christopher",Paul Ekman,"=""1118608577""","=""9781118608579""",1,3.62,Wiley,Paperback,256,2014,2014,2018/05/08,2018/05/01,,,read,,,,2,,,0,,,,,
70535,"2001: A Space Odyssey (Space Odyssey, #1)",Arthur C. Clarke,"Clarke, Arthur C.",,"=""0451457994""","=""9780451457998""",3,4.14,Roc,Paperback,297,2000,1968,2018/05/07,2018/04/26,,,read,,,,2,,,0,,,,,
22200,"Count Zero (Sprawl, #2)",William Gibson,"Gibson, William",,"=""0441013678""","=""9780441013678""",0,4.01,Ace Books,Paperback,308,2006,1986,,2018/05/04,to-read,to-read (#33),to-read,,,,0,,,0,,,,,
449329,The Man in the Maze,Robert Silverberg,"Silverberg, Robert",,"=""0380022621""","=""9780380022625""",3,3.81,The Hearst Corporation,Mass Market Paperback,192,1969,1968,,2018/05/03,,,read,,,,1,,,0,,,,,
10545174,Metasploit: The Penetration Tester's Guide,David  Kennedy,"Kennedy, David","Jim O'Gorman, Devon Kearns, Mati Aharoni","=""159327288X""","=""9781593272883""",3,4.04,No Starch Press,Paperback,328,2011,2011,,2018/05/02,,,read,,,,1,,,0,,,,,
1067264,Reversing: Secrets of Reverse Engineering,Eldad Eilam,"Eilam, Eldad",,"=""0764574817""","=""9780764574818""",3,4.04,Wiley,Paperback,624,2005,2005,,2018/05/02,,,read,,,,1,,,0,,,,,
5052,Code to Zero,Ken Follett,"Follett, Ken",,"=""0451216725""","=""9780451216724""",3,3.71,NAL,Paperback,384,2005,2000,,2018/05/01,,,read,,,,1,,,0,,,,,
825509,A Place Called Freedom,Ken Follett,"Follett, Ken",,"=""0449225151""","=""9780449225158""",5,3.92,Ballantine Books,Paperback,437,1996,1995,,2018/05/01,,,read,,,,1,,,0,,,,,
92373,The Third Twin,Ken Follett,"Follett, Ken",,"=""033034837X""","=""9780330348379""",3,3.68,MacMillan General Books,Paperback,640,1997,1996,,2018/05/01,,,read,,,,1,,,0,,,,,
41689,The Key to Rebecca,Ken Follett,"Follett, Ken",Arto Häilä,"=""0451207793""","=""9780451207791""",5,3.88,NAL,Paperback,352,2003,1980,,2018/05/01,,,read,,,,1,,,0,,,,,
337133,Factoring Humanity,Robert J. Sawyer,"Sawyer, Robert J.",,"=""0812571290""","=""9780812571295""",0,3.78,Tor Science Fiction,Paperback,352,1999,1998,,2018/05/01,to-read,to-read (#32),to-read,,,,0,,,0,,,,,
3084431,Emotional Awareness: Overcoming the Obstacles to Psychological Balance and Compassion,Dalai Lama XIV,"XIV, Dalai Lama","Paul Ekman, Daniel Goleman","=""0805087125""","=""9780805087123""",0,4.04,Times Books,Hardcover,288,2008,2008,,2018/05/01,to-read,to-read (#31),to-read,,,,0,,,0,,,,,
18288,Critique of Pure Reason,Immanuel Kant,"Kant, Immanuel","Paul Guyer, Allen W. Wood","=""0521657296""","=""9780521657297""",0,3.93,Cambridge University Press,Paperback,796,1999,1781,,2018/05/01,to-read,to-read (#30),to-read,,,,0,,,0,,,,,
231610,The World as I See It,Albert Einstein,"Einstein, Albert",,"=""1599869659""","=""9781599869650""",0,3.88,"Filiquarian Publishing, LLC.",Paperback,128,2006,1934,,2018/05/01,to-read,to-read (#29),to-read,,,,0,,,0,,,,,
9842911,Relatività: Esposizione divulgativa,Albert Einstein,"Einstein, Albert",Bruno Cermignani,"=""8833902668""","=""9788833902661""",4,4.18,Bollati Boringhieri,Paperback,326,1991,1916,,2018/05/01,,,read,,,,1,,,0,,,,,
12617,Manufacturing Consent: The Political Economy of the Mass Media,Noam Chomsky,"Chomsky, Noam",Edward S. Herman,"=""0375714499""","=""9780375714498""",0,4.24,Pantheon,Paperback,412,2002,1988,,2018/05/01,to-read,to-read (#28),to-read,,,,0,,,0,,,,,
3245424,"Guida galattica per gli autostoppisti (Guida galattica per gli autostoppisti, #1)",Douglas Adams,"Adams, Douglas",Laura Serra,"=""8804464631""","=""9788804464631""",0,4.22,Mondadori,Paperback,213,1999,1979,,2018/05/01,to-read,to-read (#27),to-read,,,,0,,,0,,,,,
179744,"The Emperor's New Mind: Concerning Computers, Minds and the Laws of Physics",Roger Penrose,"Penrose, Roger",Martin Gardner,"=""0192861980""","=""9780192861986""",3,3.86,"Oxford University Press, USA",Paperback,640,2002,1989,,2018/05/01,,,read,,,,1,,,0,,,,,
27771819,La Scrittura del Dio,Tiziano Gabrieli,"Gabrieli, Tiziano",,"=""8867971948""","=""9788867971947""",0,0.0,Goware,Paperback,104,2014,,,2018/05/01,to-read,to-read (#26),to-read,,,,0,,,0,,,,,
19008370,Furore,John Steinbeck,"Steinbeck, John","Sergio Claudio Perroni, Luigi Sampietro","=""8845274055""","=""9788845274053""",0,3.95,Bompiani,Paperback,656,2013,1939,,2018/05/01,to-read,to-read (#25),to-read,,,,0,,,0,,,,,
30363785,The Art of Invisibility: The World's Most Famous Hacker Teaches You How to Be Safe in the Age of Big Brother and Big Data,Kevin D. Mitnick,"Mitnick, Kevin D.",Robert Vamosi,"=""0316380504""","=""9780316380508""",1,3.99,"Little, Brown and Company",Hardcover,320,2017,2017,,2018/05/01,,,read,,,,1,,,0,,,,,
10256723,Ghost in the Wires: My Adventures as the World's Most Wanted Hacker,Kevin D. Mitnick,"Mitnick, Kevin D.","William L. Simon, Steve Wozniak","=""0316037702""","=""9780316037709""",1,3.96,"Little, Brown and Company",Hardcover,393,2011,2011,,2018/05/01,,,read,,,,1,,,0,,,,,
34628788,Guerre di Rete,Carola Frediani,"Frediani, Carola",,"=""""","=""""",3,4.33,Editori Laterza,Kindle Edition,155,2017,,,2018/05/01,,,read,,,,1,,,0,,,,,
4381,Fahrenheit 451,Ray Bradbury,"Bradbury, Ray",Alfredo Crespo,"=""0307347974""","=""9780307347978""",0,3.98,DeBolsillo,Mass Market Paperback,175,2004,1953,,2018/05/01,to-read,to-read (#24),to-read,,,,0,,,0,,,,,
8309416,Malware Analyst's Cookbook and DVD: Tools and Techniques for Fighting Malicious Code,Michael Hale Ligh,"Ligh, Michael Hale","Matt Richard, Steven Adair, Blake Hartstein","=""0470613033""","=""9780470613030""",3,4.19,Wiley,Paperback,744,2010,2010,,2018/05/01,,,read,,,,1,,,0,,,,,
1654623,I Was A Kamikaze,Ryuji Nagatsuka,"Nagatsuka, Ryuji","Robert Leckie, Nina Rootes","=""0025882805""","=""9780025882805""",0,3.97,"Macmillan Publishing Co., Inc.",Hardcover,212,1974,1972,,2018/05/01,to-read,to-read (#23),to-read,,,,0,,,0,,,,,
36201443,How to Hack Like a Pornstar,Sparc Flow,"Flow, Sparc",,"=""""","=""9781370662982""",4,4.00,Sparc Flow,ebook,,2017,,,2018/05/01,,,read,,,,1,,,0,,,,,
1173576,What Every Body is Saying: An Ex-FBI Agent's Guide to Speed-Reading People,Joe Navarro,"Navarro, Joe",Marvin Karlins,"=""0061438294""","=""9780061438295""",0,3.91,Collins,Paperback,250,2008,2008,,2018/05/01,to-read,to-read (#21),to-read,,,,0,,,0,,,,,
554464,What the Face Reveals: Basic and Applied Studies of Spontaneous Expression Using the Facial Action Coding System ,Paul Ekman,"Ekman, Paul",Erika L. Rosenberg,"=""0195179641""","=""9780195179644""",0,4.20,"Oxford University Press, USA",Hardcover,672,2005,1998,,2018/05/01,to-read,to-read (#20),to-read,,,,0,,,0,,,,,
15575,"The Sword of Shannara (The Original Shannara Trilogy, #1)",Terry Brooks,"Brooks, Terry",,"=""1857231511""","=""9781857231519""",3,3.76,Orbit,Paperback,726,1999,1977,,2018/05/01,,,read,,,,1,,,0,,,,,
33,"The Lord of the Rings (The Lord of the Rings, #1-3)",J.R.R. Tolkien,"Tolkien, J.R.R.",,"=""""","=""""",2,4.49,Houghton Mifflin Harcourt,Paperback,1216,2005,1955,,2018/05/01,,,read,,,,1,,,0,,,,,
203220,Les Fleurs du Mal,Charles Baudelaire,"Baudelaire, Charles",Richard Howard,"=""0879234628""","=""9780879234621""",3,4.26,David R. Godine Publisher,Paperback,365,1983,1857,,2018/05/01,,,read,,,,1,,,0,,,,,
8049273,"The Elegant Universe: Superstrings, Hidden Dimensions, and the Quest for the Ultimate Theory",Brian Greene,"Greene, Brian",,"=""039333810X""","=""9780393338102""",5,4.07,W. W. Norton & Company,Paperback,464,2010,1999,,2018/04/26,,,read,,,,1,,,0,,,,,
830,Snow Crash,Neal Stephenson,"Stephenson, Neal",,"=""0553380958""","=""9780553380958""",5,4.03,Bantam Books,Paperback,438,2000,1992,,2018/04/26,,,read,,,,1,,,0,,,,,
5544,"Surely You're Joking, Mr. Feynman!: Adventures of a Curious Character",Richard Feynman,"Feynman, Richard",,"=""0393316041""","=""9780393316049""",5,4.28,W. W. Norton & Company,Paperback,391,1997,1985,,2018/04/26,,,read,,,,1,,,0,,,,,
41811,The Caves of Steel (Robot #1),Isaac Asimov,"Asimov, Isaac",,"=""0586008357""","=""9780586008355""",5,4.16,Voyager,Mass Market Paperback,206,1997,1954,,2018/04/26,,,read,,,,1,,,0,,,,,
76683,Foundation's Edge (Foundation #4),Isaac Asimov,"Asimov, Isaac",,"=""0553293389""","=""9780553293388""",5,4.11,Bantam/Spectra,Paperback,450,2010,1982,,2018/04/26,,,read,,,,1,,,0,,,,,
85454,"Isaac Asimov's Caliban (Isaac Asimov's Caliban, #1)",Roger MacBride Allen,"Allen, Roger MacBride",,"=""0441004822""","=""9780441004829""",0,3.96,Ace,Paperback,312,1997,1993,,2018/04/26,to-read,to-read (#1),to-read,,,,0,,,0,,,,,
77507,"Red Mars (Mars Trilogy, #1)",Kim Stanley Robinson,"Robinson, Kim Stanley",,"=""0553560735""","=""9780553560732""",0,3.85,Spectra Books,Mass Market Paperback,572,1993,1992,,2018/04/26,to-read,to-read (#2),to-read,,,,0,,,0,,,,,
6629359,"The Strangest Man: The Hidden Life of Paul Dirac, Mystic of the Atom",Graham Farmelo,"Farmelo, Graham",,"=""0465018270""","=""9780465018277""",0,4.12,Basic Books (AZ),Hardcover,539,2009,2009,,2018/04/26,to-read,to-read (#3),to-read,,,,0,,,0,,,,,
566429,Foundation's Fear (Second Foundation Trilogy #1),Gregory Benford,"Benford, Gregory",,"=""0061056383""","=""9780061056383""",5,3.84,Eos,Mass Market Paperback,608,2000,1997,,2018/04/26,,,read,,,,1,,,0,,,,,
33426,"Hyperspace: A Scientific Odyssey Through Parallel Universes, Time Warps, and the Tenth Dimension",Michio Kaku,"Kaku, Michio",,"=""0192861891""","=""9780192861894""",5,4.12,Oxford Univ Pr (T),Paperback,359,1998,1994,,2018/04/26,,,read,,,,1,,,0,,,,,
166190,Computer Networks,Andrew S. Tanenbaum,"Tanenbaum, Andrew S.",,"=""0130661023""","=""0076092022473""",0,4.06,Prentice Hall,Hardcover,912,2002,1981,,2018/04/27,,,read,,,,1,,,0,,,,,
515601,The C Programming Language,Brian W. Kernighan,"Kernighan, Brian W.",Dennis M. Ritchie,"=""0131103628""","=""9780131103627""",4,4.41,Prentice Hall,Paperback,288,1988,1978,,2018/04/27,,,read,,,,1,,,0,,,,,
105123,More Effective C++,Scott Meyers,"Meyers, Scott",,"=""020163371X""","=""0785342633719""",4,4.33,Addison-Wesley Professional,Paperback,336,1996,1995,,2018/04/27,,,read,,,,1,,,0,,,,,
23217119,Windows Via C/C++,Jeffrey Richter,"Richter, Jeffrey",Christophe Nasarre,"=""0735642982""","=""9780735642980""",4,3.83,Microsoft Press,ebook,,2007,2007,,2018/04/27,,,read,,,,1,,,0,,,,,
21820378,Mastering Bitcoin: Unlocking Digital Cryptocurrencies,Andreas M. Antonopoulos,"Antonopoulos, Andreas M.",,"=""1449374042""","=""9781449374044""",2,4.33,O'Reilly Media,Paperback,298,2014,2014,,2018/04/27,,,read,,,,1,,,0,,,,,
6684923,Unauthorised Access: Physical Penetration Testing for IT Security Teams,Wil Allsopp,"Allsopp, Wil",Kevin D. Mitnick,"=""0470747617""","=""9780470747612""",5,3.86,Wiley,Paperback,287,2009,2009,,2018/04/27,,,read,,,,1,,,0,,,,,
8631270,Practical Lock Picking: A Physical Penetration Tester's Training Guide,Deviant Ollam,"Ollam, Deviant",,"=""1597496111""","=""9781597496117""",4,4.22,Syngress,Paperback,236,2010,2010,,2018/04/27,,,read,,,,1,,,0,,,,,
32027337,Advanced Penetration Testing: Hacking the World's Most Secure Networks,Wil Allsopp,"Allsopp, Wil",,"=""1119367689""","=""9781119367680""",4,4.21,Wiley,Paperback,288,2017,,,2018/04/27,,,read,,,,1,,,0,,,,,
17891588,The Browser Hacker's Handbook,Wade Alcorn,"Alcorn, Wade","Christian Frichot, Michele Orru","=""1118662105""","=""9781118662106""",3,4.06,Wiley,ebook,648,2014,2014,,2018/04/27,,,read,,,,1,,,0,,,,,
17628293,Android Hacker's Handbook,Joshua J. Drake,"Drake, Joshua J.","Zach Lanier, Collin Mulliner, Pau Oliva Fora, Stephen A. Ridley, Georg Wicherski","=""111860864X""","=""9781118608647""",3,3.98,Wiley,Paperback,545,2014,2013,,2018/04/27,,,read,,,,1,,,0,,,,,
3004460,The IDA Pro Book: The Unofficial Guide to the World's Most Popular Disassembler,Chris Eagle,"Eagle, Chris",,"=""1593271786""","=""9781593271787""",5,4.33,No Starch Press,Paperback,640,2008,2008,,2018/04/27,,,read,,,,1,,,0,,,,,
6478938,In Asia,Tiziano Terzani,"Terzani, Tiziano",,"=""8850206178""","=""9788850206179""",5,4.23,TEA,Paperback,434,2004,1998,,2018/04/27,,,read,,,,1,,,0,,,,,
30420524,The Cellular Automaton Interpretation of Quantum Mechanics,Gerard 't Hooft,"Hooft, Gerard 't",,"=""3319412841""","=""9783319412849""",0,4.22,Springer,Hardcover,298,2016,,,2018/04/27,to-read,to-read (#4),to-read,,,,0,,,0,,,,,
99245,Nightfall,Isaac Asimov,"Asimov, Isaac",Robert Silverberg,"=""0553290991""","=""9780553290998""",0,4.03,Bantam Books,Paperback,339,2012,1990,,2018/04/27,to-read,to-read (#5),to-read,,,,0,,,0,,,,,
11976774,Who's in Charge? Free Will and the Science of the Brain,Michael S. Gazzaniga,"Gazzaniga, Michael S.",,"=""0061906107""","=""9780061906107""",0,3.97,Ecco,Hardcover,260,2011,2011,,2018/04/27,to-read,to-read (#6),to-read,,,,0,,,0,,,,,
40445,"Altered Carbon (Takeshi Kovacs, #1)",Richard K. Morgan,"Morgan, Richard K.",,"=""0345457692""","=""9780345457691""",0,4.06,Del Rey Books,Mass Market Paperback,526,2006,2002,,2018/04/27,to-read,to-read (#7),to-read,,,,0,,,0,,,,,
36407347,"The Future of Humanity: Terraforming Mars, Interstellar Travel, Immortality, and Our Destiny Beyond Earth",Michio Kaku,"Kaku, Michio",,"=""0241304849""","=""9780241304846""",0,4.14,Allen Lane,Hardcover,368,2018,2018,,2018/04/28,to-read,to-read (#8),to-read,,,,0,,,0,,,,,
375802,"Ender's Game (Ender's Saga, #1)",Orson Scott Card,"Card, Orson Scott",,"=""0812550706""","=""9780812550702""",0,4.30,TOR,Mass Market Paperback,324,1994,1985,,2018/04/28,to-read,to-read (#9),to-read,,,,0,,,0,,,,,
10157578,Il cervello anarchico,Enzo Soresi,"Soresi, Enzo",,"=""8802071667""","=""9788802071664""",0,3.60,UTET libreria,Paperback,213,2005,2005,,2018/04/30,to-read,to-read (#10),to-read,,,,0,,,0,,,,,
31625636,We Have No Idea: A Guide to the Unknown Universe,Jorge Cham,"Cham, Jorge",Daniel Whiteson,"=""0735211515""","=""9780735211513""",0,4.26,Riverhead Books,Hardcover,368,2017,2017,,2018/05/01,to-read,to-read (#11),to-read,,,,0,,,0,,,,,
35167718,"""What Do You Care What Other People Think?"": Further Adventures of a Curious Character",Richard Feynman,"Feynman, Richard",Ralph Leighton,"=""0393355640""","=""9780393355642""",0,4.27,W. W. Norton  Company,Paperback,288,2018,1988,,2018/05/01,to-read,to-read (#12),to-read,,,,0,,,0,,,,,
10260,The Pleasure of Finding Things Out: The Best Short Works of Richard P. Feynman,Richard Feynman,"Feynman, Richard","Jeffrey Robbins, Freeman Dyson","=""0465023959""","=""9780465023950""",0,4.24,Basic Books,Paperback,270,2005,1999,,2018/05/01,to-read,to-read (#13),to-read,,,,0,,,0,,,,,
17375,The Meaning of It All: Thoughts of a Citizen-Scientist,Richard Feynman,"Feynman, Richard",,"=""0465023940""","=""9780465023943""",0,4.05,Basic Books,Paperback,144,2005,1998,,2018/05/01,to-read,to-read (#14),to-read,,,,0,,,0,,,,,
291920,The Character of Physical Law,Richard Feynman,"Feynman, Richard",James Gleick,"=""0679601279""","=""9780679601272""",0,4.29,Modern Library,Hardcover,192,1994,1964,,2018/05/01,to-read,to-read (#15),to-read,,,,0,,,0,,,,,
5550,Perfectly Reasonable Deviations from the Beaten Track: Letters of Richard P. Feynman,Richard Feynman,"Feynman, Richard",Michelle Feynman,"=""0738206369""","=""9780738206363""",0,4.24,Basic Books,cloth,512,2005,2004,,2018/05/01,to-read,to-read (#16),to-read,,,,0,,,0,,,,,
61666,Contact,Carl Sagan,"Sagan, Carl",,"=""2266079999""","=""9782266079990""",0,4.13,Pocket,Mass Market Paperback,580,1997,1985,,2018/05/01,to-read,to-read (#17),to-read,,,,0,,,0,,,,,
55030,Cosmos,Carl Sagan,"Sagan, Carl",,"=""0375508325""","=""9780375508325""",0,4.36,Random House,Mass Market Paperback,384,2002,1980,,2018/05/01,to-read,to-read (#18),to-read,,,,0,,,0,,,,,
496695,Geek Mafia,Rick Dakan,"Dakan, Rick",,"=""0977264904""","=""9780977264902""",0,3.62,Blue King Studios,Paperback,320,2006,2006,,2018/05/01,to-read,to-read (#19),to-read,,,,0,,,0,,,,,
1638947,Higher Math For Beginners: Mostly Physicists And Engineers,Yakov B. Zel'dovich,"Zel'dovich, Yakov B.",,"=""0133876489""","=""9780133876482""",5,4.56,,,,,,,2018/04/27,,,read,,,,1,,,0,,,,,
41821,The Gods Themselves,Isaac Asimov,"Asimov, Isaac",,"=""1857989341""","=""9781857989342""",5,4.09,Millenium,Paperback,288,2000,1972,,2018/04/27,,,read,,,,1,,,0,,,,,
30016,The Naked Sun (Robot #2),Isaac Asimov,"Asimov, Isaac",,"=""0586010165""","=""9780586010167""",5,4.14,HarperCollins Publishers,Mass Market Paperback,208,1996,1956,,2018/04/27,,,read,,,,1,,,0,,,,,
83539,Fantastic Voyage,Isaac Asimov,"Asimov, Isaac",,"=""0553275720""","=""9780553275728""",5,3.90,Bantam,Paperback,208,1988,1966,,2018/04/27,,,read,,,,1,,,0,,,,,
41820,Pebble in the Sky (Galactic Empire #3),Isaac Asimov,"Asimov, Isaac",,"=""0553293427""","=""9780553293425""",5,3.87,Bantam,Paperback,308,1991,1950,,2018/04/27,,,read,,,,1,,,0,,,,,
41822,"The Stars, Like Dust (Galactic Empire, #1)",Isaac Asimov,"Asimov, Isaac",,"=""0553293435""","=""9780553293432""",5,3.73,Spectra,Mass Market Paperback,304,1991,1951,,2018/04/27,,,read,,,,1,,,0,,,,,
302625,Nemesis,Isaac Asimov,"Asimov, Isaac",,"=""0553286285""","=""9780553286281""",5,3.76,Bantam/Spectra,Mass Market Paperback,386,1990,1989,,2018/04/27,,,read,,,,1,,,0,,,,,
85434,The Currents of Space (Galactic Empire #2),Isaac Asimov,"Asimov, Isaac",,"=""0553293419""","=""9780553293418""",5,3.83,Spectra,Paperback,304,1991,1952,,2018/04/27,,,read,,,,1,,,0,,,,,
70787,The Bicentennial Man and Other Stories,Isaac Asimov,"Asimov, Isaac",,"=""1857989325""","=""9781857989328""",5,4.08,Millennium,Paperback,211,2000,1976,,2018/04/27,,,read,,,,1,,,0,,,,,
41818,Robot Dreams (Robot #0.4),Isaac Asimov,"Asimov, Isaac",,"=""0441011837""","=""9780441011834""",5,4.14,Ace Trade,Paperback,352,2004,1986,,2018/04/27,,,read,,,,1,,,0,,,,,
41823,Robot Visions,Isaac Asimov,"Asimov, Isaac",Ralph McQuarrie,"=""0451450647""","=""9780451450647""",5,4.21,RoC,Mass Market Paperback,496,1991,1990,,2018/04/27,,,read,,,,1,,,0,,,,,
30010,"The Complete Stories, Vol 1",Isaac Asimov,"Asimov, Isaac",,"=""038541627X""","=""9780385416276""",5,4.36,Broadway,Paperback,624,1990,1990,,2018/04/27,,,read,,,,1,,,0,,,,,
272773,The Rest of the Robots (Robot #0.2),Isaac Asimov,"Asimov, Isaac",,"=""0586025944""","=""9780586025949""",5,4.08,Granada Publishing in Panther books,Mass Market Paperback,224,1968,1964,,2018/04/27,,,read,,,,1,,,0,,,,,
9432902,Flashback,Dan Simmons,"Simmons, Dan",,"=""0316006963""","=""9780316006965""",4,3.26,Reagan Arthur Books,Hardcover,554,2011,2011,,2018/04/27,,,read,,,,1,,,0,,,,,
154091,"Mona Lisa Overdrive (Sprawl, #3)",William Gibson,"Gibson, William",,"=""0553281747""","=""9780553281743""",5,3.98,Bantam Spectra,Mass Market Paperback,308,1989,1988,,2018/04/27,,,read,,,,1,,,0,,,,,
313998,Johnny Mnemonic,William Gibson,"Gibson, William",Terry Bisson,"=""000224618X""","=""9780002246187""",5,3.76,HarperCollins,Hardcover,160,1996,1981,,2018/04/27,,,read,,,,1,,,0,,,,,
4588,Extremely Loud and Incredibly Close,Jonathan Safran Foer,"Foer, Jonathan Safran",,"=""0618711651""","=""9780618711659""",2,3.98,Mariner Books,Paperback,326,2006,2005,,2018/04/27,,,read,,,,1,,,0,,,,,
10561885,"Solido, liquido o gassoso?",Domenica Luciani,"Luciani, Domenica",,"=""8809211030""","=""9788809211032""",5,3.83,Giunti Junior,Paperback,157,1999,1999,,2018/04/28,,,read,,,,1,,,0,,,,,
9708329,Nascita Di Un Guru,Takeshi Kitano,"Kitano, Takeshi",L. Brambilla,"=""8804557028""","=""9788804557029""",2,2.84,Mondadori,Paperback,200,2006,1990,,2018/04/28,,,read,,,,1,,,0,,,,,
836555,Crypto ,Dan Brown,"Brown, Dan",Paola Frezza Pavese,"=""880455987X""","=""9788804559870""",4,3.63,Mondadori,Hardcover,427,2006,1998,,2018/04/28,,,read,,,,1,,,0,,,,,
6527580,"La biblioteca dei morti (Will Piper, #1)",Glenn Cooper,"Cooper, Glenn",Gian Paolo Gasperi,"=""8842916064""","=""9788842916062""",4,3.75,Editrice Nord,Hardcover,439,2009,2009,,2018/04/28,,,read,,,,1,,,0,,,,,
9710374,L'arte dell'inganno: I consigli dell'hacker più famoso del mondo,Kevin D. Mitnick,"Mitnick, Kevin D.","William L. Simon, Giancarlo Carlotti, Roul Chiesa","=""8807818418""","=""9788807818417""",1,3.76,Feltrinelli,Paperback,324,2005,2001,,2018/04/28,,,read,,,,1,,,0,,,,,
830502,It,Stephen King,"King, Stephen",,"=""0450411435""","=""9780450411434""",4,4.23,New English Library,Paperback,1116,1987,1986,,2018/04/28,,,read,,,,1,,,0,,,,,
17164592,"Il primo bicchiere, come sempre, è il migliore",Charles Bukowski,"Bukowski, Charles",Damiano Abeni,"=""8875210802""","=""9788875210809""",4,3.67,Minimum Fax,Paperback,225,2006,,,2018/04/28,,,read,,,,1,,,0,,,,,
3407979,Il silenzio degli innocenti,Thomas   Harris,"Harris, Thomas",Roberta Rambelli,"=""880433374X""","=""9788804333746""",5,4.17,Mondadori,Paperback,383,1991,1988,,2018/04/28,,,read,,,,1,,,0,,,,,
1855674,... E venne chiamata due cuori,Marlo Morgan,"Morgan, Marlo",Maria Barbara Piccioli,"=""8845407039""","=""9788845407031""",4,3.78,Sonzogno,Paperback,219,1994,1990,,2018/04/28,,,read,,,,1,,,0,,,,,
18215286,"Spazio, tempo e universo. Passato, presente e futuro della teoria della relatività",Tullio Regge,"Regge, Tullio",Giulio Peruzzi,"=""8877508248""","=""9788877508249""",3,2.67,UTET libreria,Paperback,158,2003,2003,,2018/04/28,,,read,,,,1,,,0,,,,,
